priority,source_id,title,url,why_download,status,local_pdf
high,OA01,Effects of Print Parameters and Heat Treatment on Fatigue of Laser Powder Bed Fused Inconel 718,https://oaktrust.library.tamu.edu/bitstreams/e06ac7ee-208b-4613-88c3-cea2181bc623/download,Directly relevant: fatigue + heat treatment + LPBF IN718 thesis.,fulfilled_2026-07-01,NEW17_MARINO_THESIS_2022.pdf
high,OA02,Optimization of the Post-Process Heat Treatment of Inconel 718 Superalloy Fabricated by LPBF,https://www.mdpi.com/2075-4701/11/1/144,"Directly relevant: heat-treatment optimization, tensile/hardness/texture.",fulfilled_2026-07-01,NEW12_metals_11_00144_v3.pdf
high,OA03,Influence of Homogenization and Solution Treatments Time on Microstructure and Hardness of Inconel 718 Fabricated by LPBF,https://www.mdpi.com/1996-1944/13/11/2574,Directly relevant: heat-treatment variables and hardness/microstructure.,fulfilled_2026-07-01,NEW14_materials_13_02574_v2.pdf
high,OA05,Effects of Process Parameters and Heat Treatment on Microstructure and Mechanical Characteristics of LPBF Inconel 718,https://www.mdpi.com/2079-6412/13/1/189,Directly relevant: process + heat treatment + mechanical properties.,fulfilled_2026-07-01,NEW15_coatings_13_00189.pdf
medium,OA09,Improved Properties of Additively Prepared Inconel 718 Alloy Post-Processed with a New Heat Treatment,https://papers.ssrn.com/sol3/papers.cfm?abstract_id=4798171,Relevant if accessible: new heat treatment with mechanical/fatigue properties.,fulfilled_2026-07-01,NEW16_ssrn_4798171.pdf
medium,Purdue_30814061,The High Cycle Fatigue Response Of A Topology Optimized LPBF Inconel 718 Feature-Based Component,https://hammer.purdue.edu/articles/thesis/The_High_Cycle_Fatigue_Response_Of_A_Topology_Optimized_Laser_Powder_Bed_Fusion_Inconel_718_Feature-Based_Component/30814061,Relevant for fatigue validation/background; may be geometry-specific.,still_pending_or_background,
low,OA07,Tailoring Heat Treatments for Metals Processed by Laser Powder Bed Fusion,https://bib-pubdb1.desy.de/record/476532,Broad LPBF heat-treatment thesis/background; not all IN718.,still_pending_or_background,
low,OA11,Microstructure Evolution in Inconel 718 Produced by Powder Bed Fusion,https://www.mdpi.com/2504-4494/6/1/20,Useful microstructure background; weaker for direct HT recommendation if property table sparse.,still_pending_or_background,
